{
  "$schema": "http://json-schema.org/draft-07/schema#",
  "$id": "https://harmonia.local/schemas/instrument-catalog.schema.json",
  "title": "Harmonia Instrument Catalog",
  "type": "object",
  "additionalProperties": false,
  "required": [
    "version",
    "generated_at",
    "description",
    "categories",
    "instruments"
  ],
  "properties": {
    "version": {
      "type": "string",
      "minLength": 1
    },
    "generated_at": {
      "type": "string",
      "format": "date-time"
    },
    "description": {
      "type": "string",
      "minLength": 1
    },
    "categories": {
      "type": "array",
      "minItems": 1,
      "uniqueItems": true,
      "items": {
        "type": "string",
        "minLength": 1
      }
    },
    "instruments": {
      "type": "array",
      "minItems": 1,
      "items": {
        "type": "object",
        "additionalProperties": false,
        "required": [
          "id",
          "name",
          "category",
          "presets"
        ],
        "properties": {
          "id": {
            "type": "string",
            "pattern": "^[a-z0-9_]+$"
          },
          "name": {
            "type": "string",
            "minLength": 1
          },
          "category": {
            "type": "string",
            "minLength": 1
          },
          "presets": {
            "type": "array",
            "items": {
              "type": "string",
              "minLength": 1
            }
          },
          "fallback_rules": {
            "type": "array",
            "uniqueItems": true,
            "items": {
              "type": "string",
              "pattern": "^[a-z0-9_]+$"
            }
          },
          "sample_references": {
            "type": "array",
            "items": {
              "type": "string",
              "minLength": 1
            }
          },
          "polyphony_limit": {
            "type": "integer",
            "minimum": 1
          },
          "range": {
            "type": "string",
            "minLength": 1
          }
        }
      }
    }
  }
}
